{
  "$schema": "../instruction.schema.json",
  "instruction": {
    "id": "technical-kinetic-svg",
    "title": "Technical-Kinetic SVG Generation",
    "purpose": "Generate mid-century modern style SVG illustrations with kinetic art influences, B&W technical aesthetic",
    "category": "image",
    "prompt": "Create an SVG illustration of {{subject}} in the Technical-Kinetic style.\n\nStyle Requirements:\n- Mid-Century Modern meets kinetic art\n- Black and white only (no grayscale)\n- Clean geometric forms\n- Precise technical linework\n- Bauhaus/Swiss design influence\n- Motion implied through repetition or rays\n\nTechnical Constraints:\n- Pure SVG markup (no embedded images)\n- Maximum 50 path elements\n- Viewbox: 0 0 400 300\n- Use only: line, circle, rect, path, polygon\n- No gradients, only solid fills\n\nOutput:\n```svg\n[Complete SVG code here]\n```\n\nBriefly explain the design choices.",
    "system_prompt": "You are a graphic designer specializing in mid-century modern and technical illustration. Your SVGs are clean, geometric, and print-ready.",
    "variables": [
      {
        "name": "subject",
        "description": "What to illustrate (e.g., 'water filter', 'solar panel', 'compass')",
        "required": true
      }
    ],
    "examples": [
      {
        "input": "radio antenna",
        "output": "SVG with concentric circles emanating from central tower, geometric base, radiating lines suggesting transmission",
        "notes": "Good use of repetition for kinetic effect"
      }
    ]
  },
  "metadata": {
    "version": "1.0.0",
    "created": "2026-01-06",
    "author": "uDOS Dev",
    "source_provider": "gemini",
    "iterations": 5,
    "tags": ["svg", "image", "technical", "mid-century", "kinetic", "b&w"],
    "quality_score": 7.5
  },
  "execution": {
    "offline_capable": true,
    "recommended_model": "gemini-2.0-flash",
    "fallback_models": ["claude-3-sonnet", "gpt-4"],
    "temperature": 0.7,
    "max_tokens": 4096,
    "timeout_seconds": 120
  },
  "lineage": {
    "derived_from": null,
    "changelog": [
      {
        "version": "1.0.0",
        "date": "2026-01-06",
        "changes": "Initial version based on gemini-image.md Technical-Kinetic style"
      }
    ]
  }
}
